{
  "global_status": "APPROVED_WITH_REMARKS",
  "global_failure": false,
  "send_real_allowed": false,
  "date": "2026-05-14",
  "mode": "SHADOW",
  "prompt_version": "v3.0",
  "data_builder_version": "v1.0",
  "recipients": {
    "lucas": {
      "platform": "shopee",
      "status": "APPROVED",
      "send_allowed": false,
      "slack_payload": {
        "channel": "#lucas-daily-sales",
        "text": "Daily Sales Report — 14/05/2026 (Shopee)",
        "blocks": [
          {
            "type": "header",
            "text": { "type": "plain_text", "text": "Daily Sales Report — 14/05/2026" }
          },
          {
            "type": "section",
            "text": { "type": "mrkdwn", "text": "*Shopee — Budamix Store + Oficial 2 + Shop 3*\n\nDia positivo com crescimento de 12% vs média 7d..." }
          }
        ]
      },
      "layers": {
        "layer0_data_package": "reports/daily-sales-report-v2/layered/packages/2026-05-14/package.json",
        "layer1_estrategica": "Trajetória ascendente confirmada, base saudável, sem risco estrutural",
        "layer2_tatica": "Foco em consolidação do ticket médio, oportunidade em Shop 3",
        "layer3_operacional": "42 pedidos válidos, GMV R$3.850, ticket médio R$91,67, 0 cancelamentos",
        "layer4_granular": "Top 3 produtos concentram 38%, nenhum risco de identificação",
        "layer5_condensadora": "3 insights sobreviveram: crescimento consistente, ticket acima da média, Shop 3 acelerando",
        "layer6_slack_writer": "Mensagem gerada com sucesso, template validado",
        "layer7_qa_gate": "APPROVED — 12/12 checks passed"
      },
      "qa": {
        "verdict": "APPROVED",
        "checks_passed": 12,
        "checks_total": 12,
        "blockers": [],
        "remarks": []
      },
      "blockers": [],
      "warnings": []
    },
    "yasmin": {
      "platform": "mercado_livre",
      "status": "APPROVED_WITH_REMARKS",
      "send_allowed": false,
      "slack_payload": {
        "channel": "#yasmin-daily-sales",
        "text": "Daily Sales Report — 14/05/2026 (Mercado Livre)",
        "blocks": [
          {
            "type": "header",
            "text": { "type": "plain_text", "text": "Daily Sales Report — 14/05/2026" }
          },
          {
            "type": "section",
            "text": { "type": "mrkdwn", "text": "*Mercado Livre*\n\nDia estável com leve queda de 5% vs média 7d..." }
          }
        ]
      },
      "layers": {
        "layer0_data_package": "reports/daily-sales-report-v2/layered/packages/2026-05-14/package.json",
        "layer1_estrategica": "Estabilidade com viés levemente negativo, sem risco estrutural",
        "layer2_tatica": "Monitorar ticket médio que caiu 8% — possível efeito de promoção",
        "layer3_operacional": "28 pedidos válidos, GMV R$4.200, ticket médio R$150, 1 cancelamento",
        "layer4_granular": "Top produto representa 22%, concentração saudável",
        "layer5_condensadora": "2 insights: estabilidade com ressalva no ticket, promoção como hipótese",
        "layer6_slack_writer": "Mensagem gerada com ressalva preservada",
        "layer7_qa_gate": "APPROVED_WITH_REMARKS — 11/12 checks, 1 remark"
      },
      "qa": {
        "verdict": "APPROVED_WITH_REMARKS",
        "checks_passed": 11,
        "checks_total": 12,
        "blockers": [],
        "remarks": ["Ticket médio abaixo da banda 7d — ressalva preservada na análise"]
      },
      "blockers": [],
      "warnings": ["Ticket médio abaixo da banda 7d"]
    },
    "leonardo": {
      "platform": "amazon",
      "status": "APPROVED",
      "send_allowed": false,
      "slack_payload": {
        "channel": "#leonardo-daily-sales",
        "text": "Daily Sales Report — 14/05/2026 (Amazon)",
        "blocks": [
          {
            "type": "header",
            "text": { "type": "plain_text", "text": "Daily Sales Report — 14/05/2026" }
          },
          {
            "type": "section",
            "text": { "type": "mrkdwn", "text": "*Amazon*\n\nDia dentro da normalidade, 15 pedidos..." }
          }
        ]
      },
      "layers": {
        "layer0_data_package": "reports/daily-sales-report-v2/layered/packages/2026-05-14/package.json",
        "layer1_estrategica": "Operação estável, sem sinais de alerta",
        "layer2_tatica": "Manter execução atual, sem mudança de prioridade",
        "layer3_operacional": "15 pedidos válidos, GMV R$2.100, ticket médio R$140, 0 cancelamentos",
        "layer4_granular": "Produtos identificados por ASIN, nenhum risco",
        "layer5_condensadora": "2 insights: operação estável, oportunidade de ampliar mix",
        "layer6_slack_writer": "Mensagem gerada com sucesso",
        "layer7_qa_gate": "APPROVED — 12/12 checks passed"
      },
      "qa": {
        "verdict": "APPROVED",
        "checks_passed": 12,
        "checks_total": 12,
        "blockers": [],
        "remarks": []
      },
      "blockers": [],
      "warnings": []
    }
  },
  "escalation": {
    "required": false,
    "reason": null,
    "severity": "low",
    "details": null
  },
  "memory_updates": {
    "suggested": [
      {
        "account": "shopee-budamix-store",
        "type": "daily",
        "content": "2026-05-14: Dia positivo, +12% vs média 7d, ticket médio acima da banda",
        "reason": "Registro de tendência ascendente para consolidação semanal"
      }
    ],
    "applied": []
  },
  "audit_refs": {
    "run_dir": "shared/daily-sales-analyst/runs/2026-05-14/",
    "manifest_path": "shared/daily-sales-analyst/runs/2026-05-14/manifest.json",
    "layer_artifacts": {
      "lucas": {
        "data_package": "runs/2026-05-14/lucas/00-data-package.json",
        "estrategica": "runs/2026-05-14/lucas/01-estrategica.md",
        "tatica": "runs/2026-05-14/lucas/02-tatica.md",
        "operacional": "runs/2026-05-14/lucas/03-operacional.md",
        "granular": "runs/2026-05-14/lucas/04-granular.json",
        "condensadora": "runs/2026-05-14/lucas/05-condensadora.json",
        "slack_preview": "runs/2026-05-14/lucas/06-slack-preview.md",
        "qa": "runs/2026-05-14/lucas/07-qa.json"
      },
      "yasmin": {
        "data_package": "runs/2026-05-14/yasmin/00-data-package.json",
        "estrategica": "runs/2026-05-14/yasmin/01-estrategica.md",
        "qa": "runs/2026-05-14/yasmin/07-qa.json"
      },
      "leonardo": {
        "data_package": "runs/2026-05-14/leonardo/00-data-package.json",
        "estrategica": "runs/2026-05-14/leonardo/01-estrategica.md",
        "qa": "runs/2026-05-14/leonardo/07-qa.json"
      }
    }
  }
}
